14147	370781	"Verify we have good destination addresses. The caller is
responsible for making certain we don't attempt to load
the new image into invalid or reserved areas of RAM. This
just verifies it is an address we can use.

Since the kernel does everything in page size chunks ensure
the destination addreses are page aligned. Too many
special cases crop of when we don't do this. The most
insidious is getting overlapping destination addresses
simply because addresses are changed to page size
granularity."
14164	371294	"Verify our destination addresses do not overlap.
If we alloed overlapping destination addresses
through very weird things can happen with no
easy explanation as one segment stops on another."
14176	371654	Do the segments overlap ?
14186	371904	"Ensure our buffer sizes are strictly less than
our memory sizes. This should always be the case,
and it is easier to check up front than to be surprised
later on."
14211	372376	Allocate and initialize a controlling structure
14223	372663	"Find a location for the control code buffer, and add it
the vector of segments so that it's pages will also be
counted as destination pages."
14251	373263	Verify we have a valid entry point
14257	373424	Allocate and initialize a controlling structure
14264	373592	"Enable the special crash kernel control page
allocation policy."
14276	374051	"Verify we have good destination addresses. Normally
the caller is responsible for making certain we don't
attempt to load the new image into invalid or reserved
areas of RAM. But crash kernels are preloaded into a
reserved area of ram. We must ensure the addresses
are in the reserved area otherwise preloading the
kernel could corrupt things."
14283	374279	Ensure we are within the crash kernel limits
14292	374517	"Find a location for the control code buffer, and add
the vector of segments so that it's pages will also be
counted as destination pages."
14385	376668	"Control pages are special, they are the intermediaries
that are needed while we copy the rest of the pages
to their final resting place. As such they must
not conflict with either the destination addresses
or memory the kernel is already using.

The only case where we really need more than one of
these are for architectures where we cannot disable
the MMU and must instead generate an identity mapped
page table for all of the memory.

At worst this runs in O(N) of the image size."
14395	376887	"Loop while I can allocate a page and the page allocated
is a destination page."
14414	377375	Remember the allocated page...
14422	377681	"Because the page is already in it's destination
location we will never allocate another page at
that address. Therefore kimage_alloc_pages
will not return it (again) and we don't need
to give it an entry in image->segment[]."
14430	377940	"Deal with the destination pages I have inadvertently allocated.

Ideally I would convert multi-page allocations into single
page allocations, and add everyting to image->dest_pages.

For now it is simpler to just free the pages."
14459	379008	"Control pages are special, they are the intermediaries
that are needed while we copy the rest of the pages
to their final resting place. As such they must
not conflict with either the destination addresses
or memory the kernel is already using.

Control pages are also the only pags we must allocate
when loading a crash kernel. All of the other pages
are specified by the segments and we just memcpy
into them directly.

The only case where we really need more than one of
these are for architectures where we cannot disable
the MMU and must instead generate an identity mapped
page table for all of the memory.

Given the low demand this implements a very simple
allocator that finds the first hole of the appropriate
size in the reserved memory region, and allocates all
of the memory up to and including the hole."
14474	379426	See if I overlap any of the segments
14481	379696	Advance the hole to the end of the segment
14487	379870	If I don't overlap any segments I have found my hole!
14572	381611	Walk through and free any extra destination pages I may have
14575	381719	Walk through and free any unuseable pages I have cached
14613	382538	Free the previous indirection page
14618	382669	"Save this indirection page until we are
done with it."
14624	382791	Free the final indirection page
14628	382889	Handle any machine specific cleanup
14631	382960	Free the kexec control pages...
14676	384224	"Here we implement safeguards to ensure that a source page
is not copied to its destination page before the data on
the destination page is no longer useful.

To do this we maintain the invariant that a source page is
either its own destination page, or it is not a
destination page at all.

That is slightly stronger than required, but the proof
that no problems will not occur is trivial, and the
implementation is simply to verify.

When allocating all pages normally this algorithm will run
in O(N) time, but in the worst case it will run in O(N^2)
time. If the runtime is a problem the data structures can
be fixed."
14683	384354	"Walk through the list of destination pages, and see if I
have a match."
14695	384635	Allocate a page, if we run out of memory give up
14699	384754	If the page cannot be used file it away
14707	384992	If it is the destination page we want use it
14711	385083	If the page is not a destination page use it
14720	385345	"I know that the page is someones destination page.
See if there is already a source page for this
destination page. And if so swap the source pages."
14723	385419	If so move it
14734	385718	"The old page I have found cannot be a
destination page, so return it."
14742	385860	"Place the page on the destination list I
will use it later."
14784	386660	Start with a clear page
14816	387364	"For crash dumps kernels we simply copy the data from
user space to it's destination.
We do things a page at a time for the sake of kmap."
14846	387989	Zero the trailing part of the page
14901	389425	"Exec Kernel system call: for obvious reasons only root may call it.

This call breaks up into three pieces.
- A generic part which loads the new kernel from the current
address space, and very carefully places the data in the
allocated pages.

- A generic part that interacts with the kernel and tells all of
the devices to shut down. Preventing on-going dmas, and placing
the devices in a consistent state so a later kernel can
reinitialize them.

- A machine specific part that includes the syscall number
and the copies the image to it's final destination. And
jumps into the image at entry.

kexec does not sync, or unmount filesystems so if you need
that to happen you need to do that yourself."
14908	389600	"A home grown binary mutex.
Nothing can wait so this mutex is safe to use
in interrupt context :)"
14919	389899	We only trust the superuser with rebooting the system.
14926	390042	"Verify we have a legal set of flags
This leaves us room for future extensions."
14930	390172	Verify we are on the appropriate architecture
14937	390377	"Put an artificial cap on the number
of segments passed to kexec_load."
14951	390786	"Because we write directly to the reserved memory
region when loading crash kernels we need a mutex here to
prevent multiple crash kernels from attempting to load
simultaneously, and to prevent a crash kernel from loading
over the top of a in use crash kernel.

KISS: always take the mutex."
14962	391031	Loading another kernel to reboot into
14966	391210	Loading another kernel to switch to if this one crashes
14970	391323	"Free any current crash dump kernel before
we corrupt it."
14991	391804	Install the new kernel, and Uninstall the old
14995	391900	Release the mutex
15014	392348	"Don't allow clients that don't understand the native
architecture to do anything."
15053	393326	"Take the kexec_lock here to prevent sys_kexec_load
running on one cpu from replacing the crash kernel
we are using after a panic on a different cpu.

If the crash kernel was not located in a fixed area
of memory the xchg(&kexec_crash_image) would be
sufficient. But since I reuse the memory..."
15110	394661	"Using ELF notes here is opportunistic.
I need a well defined structure format
for the data I pass, and I need tags
on the data to indicate what information I have
squirrelled away. ELF notes happen to provide
all of that, so there is no need to invent something new."
15124	395073	Allocate memory for saving cpu registers.
15140	395412	"parsing the ""crashkernel"" commandline

this code is intended to be called from architecture specific code"
15149	395591	"This function parses command lines in the format

crashkernel=ramsize-range:size[,...][@offset]

The function returns 0 on success and -EINVAL on failure."
15157	395840	for each entry of the comma-separated list
15161	395934	get the start of the range
15174	396224	if no ':' is here, than we read the end
15206	396842	match ?
15236	397390	"That function parses ""simple"" (old) crashkernel command lines like

crashkernel=size[@offset]

It returns 0 on success and -EINVAL on failure."
15258	397889	"That function is the entry point for command line parsing and should be
called from the arch-specific code."
15271	398270	find crashkernel and use the last one if there are more
15281	398457	"strlen(""crashkernel="")"
15286	398583	"if the commandline contains a ':', then that's the extended
syntax -- if not, it must be the classic syntax"
15339	399644	"provide an empty default implementation here -- architecture
code may override this"
15422	402153	"kmod, the new module loader (replaces kerneld)
Kirk Petersen

Reorganized not to be a daemon by Adam Richter, with guidance
from Greg Zornetzer.

Modified to avoid chroot and file sharing problems.
Mikael Pettersson

Limit the concurrent number of kmod modprobes to catch loops from
""modprobe needs a service that is in a module"".
Keith Owens <kaos@ocs.com.au> December 1999

Unblock all signals when we exec a usermode process.
Shuu Yamaguchi <shuu@wondernetworkresources.com> December 2000

call_usermodehelper wait flag, and remove exec_usermodehelper.
Rusty Russell <rusty@rustcorp.com.au> Jan 2003"
15450	402767	modprobe_path is set via /proc/sys.
15466	403443	"request_module - try to load a kernel module
@fmt: printf style format string for the name of the module
@varargs: arguements as specified in the format string

Load a module using the user mode module loader. The function returns
zero on success or a negative errno code on failure. Note that a
successful module load does not mean the module did not then unload
and exit on an error of its own. Callers must check that the service
they requested is now available not blindly invoke it.

If module auto-loading support is disabled then this function
becomes a no-operation."
15479	403870	Completely arbitrary value - KAO
15499	404686	"If modprobe needs a service that is in a module, we get a recursive
loop. Limit the number of running kmod threads to max_threads/2 or
MAX_KMOD_CONCURRENT, whichever is the smaller. A cleaner method
would be to run the parents of this process, counting how many times
kmod was invoked. That would mean accessing the internals of the
process tables to get the command line, proc_pid_cmdline is static
and it is not worth changing the proc code just to handle this case.
KAO.

""trace the ppid"" is simple, but will fail if someone's
parent exits. I think this is as good as it gets. --RR"
15503	404886	We may be blaming an innocent here, but unlikely
15517	405226	CONFIG_KMOD
15534	405534	This is the task which runs the usermode application
15541	405735	Unblock all signals and set the session keyring.
15552	406083	Install input pipe when needed
15556	406227	no races because files should be private here
15565	406459	and disallow core files too
15569	406582	We can run anywhere, unlike our parent keventd().
15575	406760	"Our parent is keventd, which runs with elevated scheduling priority.
Avoid propagating that into the userspace child."
15583	406930	Exec failed?
15596	407217	Keventd can't block, but this (a child) can.
15603	407429	"Install a handler: if SIGCLD isn't handled sys_wait4 won't
populate the status, but will return -ECHILD."
15620	407979	"Normally it is bogus to call wait4() from in-kernel because
wait4() wants to write the exit code to a userspace address.
But wait_for_helper() always runs as keventd, and put_user()
to a kernel address works OK for kernel threads, due to their
having an mm_segment_t which spans the entire address space.

Thus the __user pointer cast is valid here."
15627	408220	"If ret is 0, either ____call_usermodehelper failed and the
real error code is already in sub_info->retval or
sub_info->retval is 0 anyway, so don't mess with it then."
15639	408429	This is run by khelper thread
15649	408779	"CLONE_VFORK: wait until the usermode helper has execve'd
successfully We need the data structures to stay around
until that is done."
15665	409156	FALLTHROUGH
15677	409475	"If set, call_usermodehelper_exec() will exit immediately returning -EBUSY
(used for preventing user land processes from being created after the user
land has been frozen during a system-wide hibernation or suspend operation)."
15680	409544	Number of helpers running
15686	409704	"Wait queue head used by usermodehelper_pm_callback() to wait for all running
helpers to finish."
15692	409905	"Time to wait for running_helpers to become zero before the setting of
usermodehelper_disabled in usermodehelper_pm_callback() fails"
15711	410421	"From now on call_usermodehelper_exec() won't start any new
helpers, so it is sufficient if running_helpers turns out to
be zero at one point (it may be increased later, but that
doesn't matter)."
15746	411111	CONFIG_PM
15752	411309	CONFIG_PM
15763	411671	"call_usermodehelper_setup - prepare to call a usermode helper
@path: path to usermode executable
@argv: arg vector for process
@envp: environment for process

Returns either %NULL on allocation failure, or a subprocess_info
structure. This should be passed to call_usermodehelper_exec to
exec the process and free the structure."
15786	412299	"call_usermodehelper_setkeys - set the session keys for usermode helper
@info: a subprocess_info returned by call_usermodehelper_setup
@session_keyring: the session keyring for the process"
15803	412902	"call_usermodehelper_setcleanup - set a cleanup function
@info: a subprocess_info returned by call_usermodehelper_setup
@cleanup: a cleanup function

The cleanup function is just befor ethe subprocess_info is about to
be freed. This can be used for freeing the argv and envp. The
Function must be runnable in either a process context or the
context in which call_usermodehelper_exec is called."
15818	413413	"call_usermodehelper_stdinpipe - set up a pipe to be used for stdin
@sub_info: a subprocess_info returned by call_usermodehelper_setup
@filp: set to the write-end of a pipe

This constructs a pipe, and sets the read end to be the stdin of the
subprocess, and returns the write-end in *@filp."
15851	414319	"call_usermodehelper_exec - start a usermode application
@sub_info: information about the subprocessa
@wait: wait for the application to finish and return status.
when -1 don't wait at all, but you get no useful error back when
the program couldn't be exec'ed. This makes it safe to call
from interrupt context.

Runs a user-space application. The application is started
asynchronously if wait is not set, and runs as a child of keventd.
(ie. it runs with full root capabilities)."
15871	414760	task has freed sub_info
15894	415384	"call_usermodehelper_pipe - call a usermode helper process with a pipe stdin
@path: path to usermode executable
@argv: arg vector for process
@envp: environment for process
@filp: set to the write-end of a pipe

This is a simple wrapper which executes a usermode-helper function
with a pipe as stdin. It is implemented entirely in terms of
lower-level call_usermodehelper_* functions."
15956	417556	"Kernel Probes (KProbes)
kernel/kprobes.c

This program is free software; you can redistribute it and/or modify
it under the terms of the GNU General Public License as published by
the Free Software Foundation; either version 2 of the License, or
(at your option) any later version.

This program is distributed in the hope that it will be useful,
but WITHOUT ANY WARRANTY; without even the implied warranty of
MERCHANTABILITY or FITNESS FOR A PARTICULAR PURPOSE. See the
GNU General Public License for more details.

You should have received a copy of the GNU General Public License
along with this program; if not, write to the Free Software
Foundation, Inc., 59 Temple Place - Suite 330, Boston, MA 02111-1307, USA.



2002-Oct Created by Vamsi Krishna S <vamsi_krishna@in.ibm.com> Kernel
Probes initial implementation (includes suggestions from
Rusty Russell).
2004-Aug Updated by Prasanna S Panchamukhi <prasanna@in.ibm.com> with
hlists and exceptions notifier as suggested by Andi Kleen.
2004-July Suparna Bhattacharya <suparna@in.ibm.com> added jumper probes
interface to access function arguments.
2004-Sep Prasanna S Panchamukhi <prasanna@in.ibm.com> Changed Kprobes
exceptions notifier to be first on the priority list.
2005-May Hien Nguyen <hien@us.ibm.com>, Jim Keniston
<jkenisto@us.ibm.com> and Prasanna S Panchamukhi
<prasanna@in.ibm.com> added function-return probes."
15982	418180	"Some oddball architectures like 64bit powerpc have function descriptors
so this must be overridable."
15991	418497	NOTE: change this value only with kprobe_mutex held
15995	418583	"Protects kprobe_table
Protects kretprobe_inst_table"
16004	418990	"kprobe->ainsn.insn points to the copy of the instruction to be
single-stepped. x86_64, POWER4 and above have no-exec support and
stepping on the instruction on a vmalloced/kmalloced/data page
is a recipe for disaster"
16009	419178	Page of instruction slots
16052	420073	"get_insn_slot() - Find a slot on an executable page for an instruction.
We allocate an executable page if there's no room on existing ones."
16069	420546	Surprise! No unused slots. Fix kip->nused.
16074	420651	If there are any garbage slots, collect it and try again.
16078	420796	All out of space. Need to allocate a new page. Use slot 0.
16087	421086	"Use module_alloc so this page is within +/- 2GB of where the
kernel image and loaded module images reside. This is required
so x86_64 can correctly handle the %rip-relative fixups."
16102	421462	Return 1 if all garbages are collected, otherwise 0.
16113	421806	"Page is no longer in use. Free it unless
it's the last one. We keep the last one
so as not to have to set it up again the
next time somebody inserts a probe."
16133	422227	Ensure no-one is preepmted on the garbages
16141	422448	we will collect all garbages
16176	423245	We have preemption disabled.. so it is safe to use __ versions
16192	423613	"This routine is called either:
- under the kprobe_mutex - during kprobe_[un]register()
OR
- with preemption disabled - from arch/xxx/kernel/kprobes.c"
16210	424040	"Aggregate handlers for multiple kprobes support - these handlers
take care of invoking the individual kprobe handlers on p->list"
16248	424925	"if we faulted ""during"" the execution of a user specified
probe handler, invoke just that probe's fault handler"
16269	425383	Walks the list and increments nmissed count for multiprobe case
16282	425650	Called with kretprobe_lock held
16286	425791	remove rp inst off the rprobe_inst_table
16289	425871	remove rp inst off the used list
16291	425941	put rp inst back onto the free list
16295	426059	Unregistering
16309	426525	"This function is called from finish_task_switch when task tk becomes dead,
so that we can recycle any function-return probe instances associated
with this task. These left over instances represent probed functions
that have been called but will never return."
16345	427386	Keep all fields in the kprobe consistent
16355	427715	"Add the new probe to old_p->list. Fail if this is the
second jprobe at the address - two jprobes can't coexist"
16373	428236	"Fill in the required fields of the ""manager kprobe"". Replace the
earlier kprobe in the hlist with the manager kprobe"
16395	428784	"This is the second or subsequent kprobe at the address - handle
the intricacies"
16435	429722	"If we have a symbol_name argument look it up,
and add it to the address. That way the addr
field can either be global or relative to a symbol."
16454	430123	Check if are we probing a module.
16462	430440	"We must allow modules to probe themself and in this case
avoid incrementing the module refcount, so as to allow
unloading of self probing modules."
16518	431590	kprobe p is a valid probe
16531	431978	"Only probe on the hash list. Disarm only if kprobes are
enabled - otherwise, the breakpoint would already have
been removed. We save on flushing icache."
16576	432912	we need to be notified first
16591	433226	Todo: Verify probepoint is a function entry point
16609	433642	"This kprobe pre_handler is registered with every kretprobe. When probe
hits it will set up the return probe."
16616	433899	TODO: consider to only swap the RA after the last pre_handler fired
16627	434230	XXX(hch): why is there no hlist_move_head?
16660	435056	Pre-allocate memory for max kretprobe instances
16681	435590	Establish function entry probe point
16688	435755	ARCH_SUPPORTS_KRETPROBES
16701	435978	ARCH_SUPPORTS_KRETPROBES
16711	436176	No race here
16726	436535	"FIXME allocate the probe table, currently defined statically
initialize all list heads"
16733	436780	lookup the function address from its name
16743	437097	By default, kprobes are enabled
16787	438126	Nothing to do
16843	439495	If kprobes are already enabled, just return
16870	440040	If kprobes are already disabled, just return
16885	440439	Allow all currently running kprobes to complete
16898	440687	"XXX: The debugfs bool file interface doesn't allow for callbacks
when the bool state is switched. We can reuse that facility when
available"
16971	442078	CONFIG_DEBUG_FS
17000	442744	"kernel/lockdep_proc.c

Runtime locking correctness validator

Started by Ingo Molnar:




Code for /proc/lockdep and /proc/lockdep_stats:"
17060	443855	Recurse this class's dependency list:
17074	444142	Recurse this class's dependency list:
17268	450315	"Total number of dependencies:

All irq-safe locks may nest inside irq-unsafe locks,
plus all the other known dependencies:"
17277	450545	"Estimated factor between direct and indirect
dependencies:"
17369	453317	sort on absolute number of contentions
17396	453939	XXX: do_div_signed
17428	454636	XXX truncates versions > 9
17646	459322	CONFIG_LOCK_STAT
17698	460776	"kernel/lockdep.c

Runtime locking correctness validator

Started by Ingo Molnar:




this code maps all the lock dependencies as they occur in a live kernel
and will warn about the following classes of locking bugs:

- lock inversion scenarios
- circular lock dependencies
- hardirq/softirq safe/unsafe locking bugs

Bugs are reported even if the current locking scenario does not cause
any deadlock at this point.

I.e. if anytime in the past two locks were taken in a different order,
even if it happened for another task, even if those were different
locks (but of the same class as this lock), this code will detect it.

Thanks to Arjan van de Ven for coming up with the initial idea of
mapping lock dependencies runtime."
17739	461746	"lockdep_lock: protects the lockdep graph, the hashes and the
class/list/hash allocators.

This is one of the rare exceptions where it's justified
to use a raw spinlock - we really dont want the spinlock
code to recurse back into the lockdep code..."
17750	462086	"Make sure that if another CPU detected a bug while
walking the graph we dont change it (while the other
CPU is busy printing out stuff with the graph lock
dropped already)"
17770	462463	"Turn lock debugging off and return with 0 if it was off already,
and also release the graph lock:"
17790	462939	"All data structures here are protected by the global debug_lock.

Mutex key structs only get allocated, once during bootup, and never
get freed - this significantly simplifies the debugging code."
17909	465719	"We keep a global list of all lock classes. The list only grows,
never shrinks. The list is only accessed with the lockdep
spinlock lock held."
17914	465825	The lockdep classes are in a hash-table as well, for fast lookup:
17925	466226	"We put the lock dependency chains into a hash-table as well, to cache
their existence:"
17938	466743	"The hash key of the lock dependency chains is a hash itself too:
it's a hash of all locks taken up to that lock, including that lock.
It's a 64-bit hash, because it's important for the keys to be
unique."
17960	467081	Debugging switches:
17976	467361	Quick filtering for interesting events:
17980	467434	Example
17988	467682	Filter everything else. 1 would be to allow everything else
18004	467918	"Stack-trace: tightly packed array of stack backtrace
addresses. Protected by the graph_lock."
18047	468996	"We cannot printk in early bootup code. Not even early_printk()
might work. So we mark any initialization errors and printk
about it later on, in lockdep_info()."
18057	469258	Various lockdep statistics:
18086	470146	Locking printouts:
18223	473393	printk all lock dependencies starting at <entry>:
18262	474190	Is this the address of a static object:
18274	474413	static variable?
18281	474507	percpu var?
18294	474778	module var?
18301	474925	"To make lock name printouts unique, we calculate a unique
class->name_version generation counter:"
18324	475574	"Register a lock's class in the hash-table, if the class is not present
yet. Otherwise we look it up. We cache the result in the lock object
itself, so actual lookup of the hash should be once per lock object."
