44	2023	"linux/kernel/acct.c

BSD Process Accounting for Linux

Author: Marco van Wieringen <mvw@planets.elm.net>

Some code based on ideas and code from:
Thomas K. Dyas <tdyas@eden.rutgers.edu>

This file implements BSD-style process accounting. Whenever any
process exits, an accounting record of type ""struct acct"" is
written to the file specified with the acct() system call. It is
up to user-level programs to do useful things with the accounting
log. The kernel just provides the raw accounting information.

(C) Copyright 1995 - 1997 Marco van Wieringen - ELM Consultancy B.V.

Plugged two leaks. 1) It didn't return acct_file into the free_filps if
the file happened to be read-only. 2) If the accounting was suspended
due to the lack of space it happily allowed to reopen it and completely
lost the old acct_file. 3/10/98, Al Viro.

Now we silently close acct_file on attempt to reopen. Cleaned sys_acct().
XTerms and EMACS are manifestations of pure evil. 21/10/98, AV.

Fixed a nasty interaction with with sys_umount(). If the accointing
was suspeneded we failed to stop it on umount(). Messy.
Another one: remount to readonly didn't stop accounting.
Question: what should we do if we have CAP_SYS_ADMIN but not
CAP_SYS_PACCT? Current code does the following: umount returns -EBUSY
unless we are messing with the root. In that case we are getting a
real mess with do_remount_sb(). 9/11/98, AV.

Fixed a bunch of races (and pair of leaks). Probably not the best way,
but this one obviously doesn't introduce deadlocks. Later. BTW, found
one race (and leak) in BSD implementation.
OK, that's better. ANOTHER race and leak in BSD variant. There always
is one more bug... 10/11/98, AV.

Oh, fsck... Oopsable SMP race in do_process_acct() - we must hold
->mmap_sem to walk the vma list of current->mm. Nasty, since it leaks
a struct file opened for write. Fixed. 2/6/2000, AV."
60	2418	sector_div
67	2637	"These constants control the amount of freespace that suspend and
resume the process accounting system, and the time delay between
each check.
Turned into sysctl-controllable parameters. AV, 12/11/98"
72	2732	">foo% free space - resume
<foo% free space - suspend
foo second timeout between checks"
76	2928	External references and all of the globals.
83	3170	"This structure is used so that all the data protected by lock
can be placed in the same cache line as the lock. This primes
the cache line to have the data after getting the lock."
97	3478	Called whenever the timer says to check the free space.
105	3632	Check the amount of free space and suspend/resume accordingly.
120	3924	May block
139	4331	"If some joker switched acct_globals.file under us we'ld better be
silent and _not_ touch anything."
174	5090	"Close the old accounting file (if currently open) and then replace
it with file (if non-NULL).

NOTE: acct_globals.lock MUST be held on entry and exit."
190	5514	It's been deleted if it was used before so this is safe
210	5993	Difference from BSD - they don't do O_APPEND
236	6556	it's pinned, now give up active reference
251	6985	"sys_acct - enable/disable process accounting
@name: file name for accounting records or NULL to shutdown accounting

Returns 0 for success or negative errno values for failure.

sys_acct() is the only system call needed to implement process
accounting. It takes the name of the file where accounting records
should be written. If the filename is NULL, accounting will be
shutdown."
282	7649	"acct_auto_close - turn off a filesystem's accounting if it is on
@m: vfsmount being shut down

If the accounting is turned on for a file in the subtree pointed to
to by m, turn accounting off. Done when m is about to die."
297	8076	"acct_auto_close - turn off a filesystem's accounting if it is on
@sb: super block for the filesystem

If the accounting is turned on for a file in the filesystem pointed
to by sb, turn accounting off."
314	8550	"encode an unsigned long into a comp_t

This routine has been adopted from the encode_comp_t() function in
the kern_acct.c file of the FreeBSD operating system. The encoding
is a 13-bit fraction with a 3-bit (base 8) exponent."
318	8596	"13 bit mantissa.
Base 8 (3 bit) exponent.
Maximum fractional value."
327	8885	"Round up?
Base 8 exponent == 3 bit shift."
333	9033	If we need to round up, do it (and handle overflow correctly).
343	9147	"Clean it up and polish it off.
Shift the exponent into place
and add on the mantissa."
355	9538	"encode an u64 into a comp2_t (24 bits)

Format: 5 bit base 2 exponent, 20 bits mantissa.
The leading bit of the mantissa is not stored, but implied for
non-zero exponents.
Largest encodable value is 50 bits."
360	9610	"20 bit mantissa.
5 bit base 2 exponent.
Maximum fractional value.
Maximum exponent."
376	10095	If we need to round up, do it (and handle overflow correctly).
383	10245	Overflow. Return largest representable number instead.
394	10443	encode an u64 into a 32 bit IEEE float
417	10988	"Write an accounting entry for an exiting process

The acct_process() call is the workhorse of the process
accounting system. The struct acct is built here and then written
into the accounting file. This function should only be called from
do_exit() or when switching to a different output file."
421	11074	do_acct_process does all actual work. Caller holds the reference to file.
436	11418	"First check to see if there is enough free_space to continue
the process accounting system."
443	11571	"Fill the accounting struct with the needed info as recorded
by the different kernel functions."
449	11753	calculate run_time in nsec
454	12014	convert nsec -> AHZ
464	12327	new enlarged etime field
472	12566	we really need to bite the bullet and change layout
479	12745	backward-compatible 16 bit fields
499	13510	current->io_usage
499	13521	%%
506	13692	"Kernel segment override to datasegment and write it
to the accounting file."
511	13796	Accounting records are not subject to resource limits.
523	14181	"acct_init_pacct - initialize a new pacct_struct
@pacct: per-process accounting info struct to initialize"
534	14508	"acct_collect - collect accounting information into pacct_struct
@exitcode: task exit code
@group_dead: not 0, if this thread is the last one in the process."
577	15716	"acct_process - now just a wrapper around do_acct_process
@exitcode: task exit code

handles process accounting for an exiting task"
584	15815	accelerate the common fastpath:
624	16557	with root here
631	16736	index; upper bit indicates 'will prune'
665	17974	"One struct chunk is attached to each inode of interest.
We replace struct chunk on tagging/untagging.
Rules have pointer to struct audit_tree.
Rules have struct list_head rlist forming a list of rules over
the same tree.
References to struct chunk are collected at audit_inode{,_child}()
time and used in AUDIT_TREE rule matching.
These references are dropped at the same time we are calling
audit_free_names(), etc.

Cyclic lists galore:
tree.chunks anchors chunk.owners[].list hash_lock
tree.rules anchors rule.rlist audit_filter_mutex
chunk.trees anchors tree.same_root hash_lock
chunk.hash is a hash with middle bits of watch.inode as
a hash function. RCU, hash_lock

tree is refcounted; one reference for ""some rules on rules_list refer to
it"", one for each chunk with pointer to it.

chunk is refcounted by embedded inotify_watch.

node.index allows to get from node.list to containing chunk.
MSB of that sucker is stolen to mark taggings that we might have to
revert - several operations have very unpleasant cleanup logics and
that makes a difference. Some."
704	18841	to avoid bringing the entire thing in audit.h
764	20209	hash_lock is held by caller
771	20391	called under rcu_read_lock
796	20964	tagging and untagging inodes with trees
854	22290	result of earlier fallback
870	22699	do the best we can
918	23868	the first tagged inode becomes root of tree
932	24230	are we already there?
967	25147	result of fallback in untag
1009	26220	not a half-baked one
1029	26784	finish killing struct audit_tree
1051	27276	trim the uncommitted chunks from tree
1061	27453	reorder
1077	27858	have we run out of marked?
1103	28390	called with audit_filter_mutex
1218	30946	called with audit_filter_mutex
1238	31448	do not set rule->tree yet
1412	35021	"That gets run when evict_chunk() ends up needing to kill audit_tree.
Runs from a separate thread, with audit_cmd_mutex held."
1435	35457	Here comes the stuff asynchronous to auditctl operations
1437	35495	inode->inotify_mutex is locked
1544	39049	"audit.c -- Auditing support
Gateway between the kernel (e.g., selinux) and the user-space audit daemon.
System-call specific features have moved to auditsc.c


All Rights Reserved.

This program is free software; you can redistribute it and/or modify
it under the terms of the GNU General Public License as published by
the Free Software Foundation; either version 2 of the License, or
(at your option) any later version.

This program is distributed in the hope that it will be useful,
but WITHOUT ANY WARRANTY; without even the implied warranty of
MERCHANTABILITY or FITNESS FOR A PARTICULAR PURPOSE. See the
GNU General Public License for more details.

You should have received a copy of the GNU General Public License
along with this program; if not, write to the Free Software
Foundation, Inc., 59 Temple Place, Suite 330, Boston, MA 02111-1307 USA

Written by Rickard E. (Rik) Faith <faith@redhat.com>

Goals: 1) Integrate fully with SELinux.
2) Minimal run-time overhead:
a) Minimal when syscall auditing is disabled (audit_enable=0).
b) Small when syscall auditing is enabled and no audit record
is generated (defer as much work as possible to record
generation time):
i) context is allocated,
ii) names from getname are stored without a copy, and
iii) inode information stored from path_lookup.
3) Ability to disable syscall auditing at boot time (audit=0).
4) Usable by other parts of the kernel (if audit_log* is called,
then a syscall record will be generated automatically for the
current syscall).
5) Netlink interface to user-space.
6) Support low-overhead kernel-based filtering to minimize the
information that must be passed to user-space.

Example user-space utilities: http://people.redhat.com/sgrubb/audit/"
1568	39589	"No auditing will take place until audit_initialized != 0.
(Initialization happens after skb_init is called.)"
1573	39732	"0 - no auditing
1 - auditing enabled
2 - auditing enabled and configuration is locked/unchangeable."
1576	39815	Default state when kernel boots without any parameters.
1579	39912	If auditing cannot proceed, audit_failure selects what happens.
1583	40065	"If audit records are to be written to the netlink socket, audit_pid
contains the (non-zero) pid."
1588	40266	"If audit_rate_limit is non-zero, limit the rate of sending audit records
to that number per second. This prevents DoS attacks, but results in
audit records being dropped."
1591	40347	Number of outstanding audit_buffers allowed.
1596	40538	The identity of the user shutting down the audit system.
1607	40901	"Records can be lost in several ways:
0) [suppressed in audit_alloc]
1) out of memory in audit_log_start [kmalloc of struct audit_buffer]
2) out of memory in audit_log_move [alloc_skb]
3) suppressed due to audit_rate_limit
4) suppressed due to audit_backlog_limit"
1610	40976	The netlink socket.
1613	41031	Inotify handle.
1616	41098	Hash for inode-based rules
1621	41335	"The audit_freelist is a list of pre-allocated audit buffers (if more
than AUDIT_MAXFREE are in use, the audit buffer is freed instead of
being placed on the freelist)."
1631	41676	Serialize requests from userspace.
1636	41893	"AUDIT_BUFSIZ is the size of the temporary buffer used for formatting
audit records. Since printk uses a 1024 byte buffer, this buffer
should be at least that large."
1640	42058	"AUDIT_MAXFREE is the number of empty audit_buffers we keep on the
audit_freelist. Doing so eliminates many kmalloc/kfree calls."
1647	42406	"The audit_buffer is used when formatting an audit record. The caller
locks briefly to get the record off the freelist or to allocate the
buffer, and locks briefly to send the buffer to the netlink layer or
to place it on a transmit queue. Multiple audit_buffers can be in
use simultaneously."
1651	42518	"formatted skb ready to send
NULL or associated context"
1712	43817	"audit_log_lost - conditionally log lost audit message event
@message: the message stating reason for lost audit message

Emit at least 1 message per second, even if audit_rate_check is
throttling.
Always increment the lost messages counter."
1749	44638	check if we are locked
1765	45023	Something weird, deny request
1771	45199	If we are allowed, make the change
1774	45276	Not allowed, update reason
1784	45474	check if we are locked
1800	45862	Something weird, deny request
1806	46041	If we are allowed, make the change
1809	46121	Not allowed, update reason
1822	46355	check if we are locked
1838	46737	Something weird, deny request
1844	46910	If we are allowed, make the change
1847	46984	Not allowed, update reason
1862	47291	check if we are locked
1878	47673	Something weird, deny request
1884	47846	If we are allowed, make the change
1887	47920	Not allowed, update reason
1905	48327	Shoudn't happen
1961	49461	wait for parent to finish and send an ACK
2008	50453	Used by NLMSG_PUT
2026	50876	"audit_send_reply - send an audit reply message via netlink
@pid: process id to send reply to
@seq: sequence number
@type: audit message type
@done: done (last) flag
@multi: multi-part message flag
@payload: payload data
@size: payload size

Allocates an skb, builds the netlink message, and sends it to the pid.
No failure notifications."
2035	51204	"Ignore failure. It'll only happen if the sender goes away,
because our timeout is set to infinite."
2043	51354	"Check for appropriate CAP_AUDIT_ capabilities on incoming audit
control messages."
2071	52023	bad msg
2086	52339	loginuid of sender
2096	52555	"As soon as there's any sign of userspace auditd,
start kauditd to talk to it"
2188	55327	Maybe call audit_panic?
2226	56205	Maybe call audit_panic?
2238	56435	fallthrough
2260	57068	Maybe call audit_panic?
2272	57298	fallthrough
2319	58427	OK, here comes...
2416	60754	"Get message from skb (based on rtnetlink_rcv_skb). Each message is
processed by audit_receive_msg. Malformed skbs with wrong length are
discarded silently."
2438	61295	Receive messages from netlink socket.
2453	61656	Initialize audit support at boot time.
2472	62252	"Register the callback with selinux. This callback will be invoked
when a new policy is loaded."
2490	62726	Process kernel command-line parameter at boot time. audit=0 or audit=1.
2579	65113	"audit_serial - compute a serial number for the audit record

Compute a serial number for the audit record. Audit records are
written to user-space as soon as they are generated, so a complete
audit record may be written in several pieces. The timestamp of the
record and this serial number are used by the user-space tools to
determine which pieces belong to the same audit record. The
(timestamp,serial) tuple is unique for each syscall and is live from
syscall entry to syscall exit.

NOTE: Another possibility is to store the formatted records off the
audit context (for those records that have a context), and emit them
all at syscall exit. However, this could delay the reporting of
significant errors until syscall exit (or never, if the system
halts)."
2613	66003	"Obtain an audit buffer. This routine does locking to obtain the
audit buffer, but then no locking is required for calls to
audit_log_*format. If the tsk is a task that is currently in a
syscall, then the syscall is marked as auditable and an audit record
will be written at syscall exit. If there is no associated task, tsk
should be NULL."
2629	66610	"audit_log_start - obtain an audit buffer
@ctx: audit_context (may be NULL)
@gfp_mask: type of allocation
@type: audit message type

Returns audit_buffer pointer on success or NULL on error.

Obtain an audit buffer. This routine does locking to obtain the
audit buffer, but then no locking is required for calls to
audit_log_*format. If the task (ctx) is a task that is currently in a
syscall, then the syscall is marked as auditable and an audit record
will be written at syscall exit. If there is no associated task, then
task context (ctx) should be NULL."
2649	67090	"Allow atomic callers to go up to five
entries over the normal backlog limit"
2656	67380	Wait for auditd to drain the queue a little
2701	68614	"audit_expand - expand skb in the audit buffer
@ab: audit_buffer
@extra: space to add at tail of the skb

Returns 0 (no space) on failed expansion, or available space if
successful."
2719	69195	"Format an audit message into the audit buffer. If there isn't enough
room in the audit buffer, more room will be allocated and vsnprint
will be called a second time. Currently, we assume that a printk
can't format message larger than 1024 bytes, so we don't either."
2743	69793	"The printk buffer is 1024 bytes long, so if we get
here and AUDIT_BUFSIZ is at least 1024, then we can
log everything that printk could have logged."
2763	70224	"audit_log_format - format a message into the audit buffer.
@ab: audit_buffer
@fmt: format string
@...: optional parameters matching @fmt string

All the work is done in audit_log_vformat."
2785	70786	"audit_log_hex - convert a buffer to hex and append it to the audit skb
@ab: the audit_buffer
@buf: buffer to convert to hex
@len: length of @buf to be converted

No return value; failure to expand is silently ignored.

This function will take the passed buf and convert it into a string of
ascii hex digits. The new string is placed onto the skb."
2802	71180	Round the buffer request up to the next multiple
2812	71419	"Upper nibble
Lower nibble"
2815	71551	new string is twice the old string
2821	71663	"Format a string of no more than slen characters into the audit buffer,
enclosed in quote marks."
2835	71975	enclosing quotes + null terminator
2847	72238	don't include null terminator
2863	72851	"audit_log_n_untrustedstring - log a string that may contain random characters
@ab: audit_buffer
@len: lenth of string (not including trailing null)
@string: string to be logged

This code will escape a string that is passed to it if the string
contains a control character, unprintable character, double quote mark,
or a space. Unescaped strings will start and end with a double quote mark.
Strings that are escaped are printed in hex (2 digits per char).

The caller specifies the number of characters in the string to log, which may
or may not be the entire string."
2886	73467	"audit_log_untrustedstring - log a string that may contain random characters
@ab: audit_buffer
@string: string to be logged

Same as audit_log_n_untrustedstring(), except that strlen is used to
determine string length."
2892	73680	This is a helper-function to print the escaped d_path
2901	73939	We will allow 11 spaces for ' (deleted)' to be appended
2909	74164	"Should never happen since we send PATH_MAX
FIXME: can we save some information here?"
2924	74619	"audit_log_end - end one audit record
@ab: the audit_buffer

The netlink_* functions cannot be called inside an irq context, so
the audit buffer is placed on a queue and a tasklet is scheduled to
remove them from the queue outside the irq context. May be called in
any context."
2956	75451	"audit_log - Log an audit record
@ctx: audit context
@gfp_mask: type of allocation
@type: audit message type
@fmt: format string to use
@...: variable parameters matching the format string

This is a convenience function that calls audit_log_start,
audit_log_vformat, and audit_log_end. It may be called
in any context."
2997	76773	"auditfilter.c -- filtering of audit events





This program is free software; you can redistribute it and/or modify
it under the terms of the GNU General Public License as published by
the Free Software Foundation; either version 2 of the License, or
(at your option) any later version.

This program is distributed in the hope that it will be useful,
but WITHOUT ANY WARRANTY; without even the implied warranty of
MERCHANTABILITY or FITNESS FOR A PARTICULAR PURPOSE. See the
GNU General Public License for more details.

You should have received a copy of the GNU General Public License
along with this program; if not, write to the Free Software
Foundation, Inc., 59 Temple Place, Suite 330, Boston, MA 02111-1307 USA"
3022	77559	"Locking model:

audit_filter_mutex:
Synchronizes writes and blocking reads of audit's filterlist
data. Rcu is used to traverse the filterlist and access
contents of structs audit_entry, audit_watch and opaque
selinux rules during filtering. If modified, these structures
must be copied and replace their counterparts in the filterlist.
An audit_parent struct is not accessed during filtering, so may
be written directly provided audit_filter_mutex is held."
3034	78017	"Reference counting:

audit_parent: lifetime is from audit_init_parent() to receipt of an IN_IGNORED
event. Each audit_watch holds a reference to its associated parent.

audit_watch: if added to lists, lifetime is from audit_init_watch() to
audit_remove_watch(). Additionally, an audit_watch may exist
temporarily to assist in searching existing filter data. Each
audit_krule holds a reference to its associated watch."
3040	78106	"entry in inotify registration list
associated watches
inotify watch data
status flags"
3051	78651	"audit_parent status flags:

AUDIT_PARENT_INVALID - set anytime rules/watches are auto-removed due to
a filesystem event to ensure we're adding audit watches to a valid parent.
Technically not needed for IN_DELETE_SELF or IN_UNMOUNT events, as we cannot
receive them while we have nameidata, but must be used for IN_MOVE_SELF which
we can receive while holding nameidata."
3054	78740	Audit filter lists, defined in <linux/audit.h>
3069	79165	Inotify handle
3072	79242	Inotify events we care about.
3104	80035	match initial get
3111	80155	some rules don't have associated watches
3131	80636	Initialize a parent watch entry.
3145	81021	grab a ref so inotify watch hangs around until we take audit_filter_mutex
3157	81285	Initialize a watch entry.
3175	81674	Initialize an audit filterlist entry.
3196	82137	"Unpack a filter field's string representation from user-space
buffer."
3206	82393	"Of the currently implemented string fields, PATH_MAX
defines the longest valid length."
3222	82682	Translate an inode field to kernel respresentation.
3234	82979	Translate a watch string to kernel respresentation.
3310	84718	"When arch is unspecified, we must check both masks on biarch
as syscall number alone is ambiguous."
3318	84953	native
3321	85069	32bit on biarch
3330	85244	Common user-space to kernel rule translation.
3396	86807	"Translate struct audit_rule to kernel's rule respresentation.
Exists for backward compatibility with userspace."
3436	87737	bit ops are only useful on syscall args
3448	87987	arch is only allowed to be = or !=
3471	88536	"Support for legacy operators where
AUDIT_NEGATE bit signifies != and otherwise assumes =="
3503	89077	Translate struct audit_rule_data to kernel's rule respresentation.
3578	90912	"Keep currently invalid fields around in case they
become valid after a policy reload."
3658	92519	Pack a filter field's string representation into data block.
3670	92795	"Translate kernel rule respresentation to struct audit_rule.
Exists for backward compatibility with userspace."
3699	93570	Translate kernel rule respresentation to struct audit_rule_data.
3757	95062	"Compare two rules in kernel format. Considered success if rules
don't match."
3797	96077	both filterkeys exist based on above type compare
3815	96450	"Duplicate the given audit watch. The new watch's rules list is initialized
to an empty list and wlist is undefined."
3841	96975	"Duplicate selinux field information. The se_rule is opaque, so must be
re-initialized."
3848	97136	our own copy of se_str
3854	97287	our own (refreshed) copy of se_rule
3858	97470	"Keep currently invalid fields around in case they
become valid after a policy reload."
3873	98013	"Duplicate an audit rule. This will be a deep copy with the exception
of the watch - that pointer is carried over. The selinux specific fields
will be updated in the copy. The point is to be able to replace the old
rule with the new rule in the filterlist, then free the old rule.
The rlist element is undefined; list manipulations are handled apart from
the initial copy."
3904	98957	"note that we are OK with not refcounting here; audit_match_tree()
never dereferences tree and we can't get false positives there
since we'd have to have rule gone from the list *and* removed
before the chunks found by lookup had been allocated, i.e. before
the beginning of list scan."
3909	99190	"deep copy this information, updating the se_rule fields, because
the originals will all be freed when the old rule is freed."
3946	99956	Update inode info in audit rules based on filesystem event.
3962	100544	"If the update involves invalidating rules, do the inode-based
filtering now, so we don't omit records."
4002	101878	event applies to a single watch
4013	102119	Remove all watches & rules associated with a parent that is going away.
4048	103197	"Unregister inotify watches for parents on in_list.
Generates an IN_IGNORED event."
4056	103463	the put matching the get in audit_do_del_rule()
4062	103603	"Find an existing audit rule.
Caller must hold audit_filter_mutex to prevent stale rule data."
4070	103846	we don't know the inode number, so must walk entire hash
4092	104275	Get path information necessary for adding watches.
4128	104944	Release resources used for watch path information.
4142	105230	"Associate the given rule with an existing parent inotify_watch.
Caller must hold audit_filter_mutex."
