46108	1187238	If the (new) signal is now blocked, requeue it.
46116	1187458	Do nothing.
46119	1187536	Run the handler.
46125	1187680	"will return non-zero ""signr"" value"
46131	1187754	"Now we are doing the default action for this signal.
Default is nothing."
46136	1187887	Global init gets no signals it doesn't want.
46150	1188395	"The default action is to stop all threads in
the thread group. The job control signals
do nothing in an orphaned pgrp, but SIGSTOP
always works. Note that siglock needs to be
dropped during the call to is_orphaned_pgrp()
because of lock ordering with tasklist_lock.
This allows an intervening SIGCONT to be posted.
We need to check for that and bail out if necessary."
46154	1188523	signals can be posted during this window
46163	1188708	It released the siglock.
46170	1188832	"We didn't actually stop, due to a race
with SIGCONT or something like that."
46178	1188962	Anything else is fatal, maybe with a core dump.
46190	1189440	"If it was able to dump core, this kills all
other threads in the group and synchronizes with
their demise. If we lost the race with another
thread getting here, it set group_exit_code
first and our do_group_exit call below will use
that value and ignore the one we pass it."
46196	1189532	Death signals, no core dump.
46198	1189575	NOTREACHED
46219	1190014	System call entry points.
46236	1190412	"We don't need to get the kernel lock - this is all local to this
particular thread.. (and that's good, because this is _heavily_
used by various programs)"
46245	1190672	"This is also useful for kernel threads that want to temporarily
(or permanently) block certain signals.

NOTE! Unlike the user-mode sys_sigprocmask(), the kernel
interface happily blocks ""unblockable"" signals like SIGKILL
and friends."
46280	1191429	XXX: Don't preclude handling different sized sigset_t's.
46323	1192417	Outside the lock because only this thread touches it.
46359	1193355	"If you change siginfo_t structure, please be sure
this code is fixed accordingly.
Please remember to update the signalfd_copyinfo() function
inside fs/signalfd.c too, in case siginfo_t changes.
It should never copy any pad contained in the structure
to avoid security leaks, but must copy the generic
3 ints plus the relevant union member."
46391	1194486	"This is not generated by the kernel as of now.
But this is"
46396	1194724	this is just in case for now ...
46418	1195177	XXX: Don't preclude handling different sized sigset_t's.
46428	1195388	"Invert the set of allowed signals to get those we
want to block."
46451	1196031	"None ready -- temporarily unblock those we're
interested while we are sleeping in so that we'll
be awakened when they arrive."
46517	1197501	"The null signal is a permissions and process existence
probe. No signal is actually delivered."
46539	1198143	"sys_tgkill - send signal to one specific thread
@tgid: the thread group ID of the thread
@pid: the PID of the thread
@sig: signal to be sent

This syscall also checks the @tgid and returns -ESRCH even if the PID
exists but it's not belonging to the target process anymore. This
method solves the problem of threads exiting and PIDs getting reused."
46542	1198243	This is only valid for single tasks
46551	1198404	Send a signal to only one task, even if it's a CLONE_THREAD task.
46555	1198493	This is only valid for single tasks
46571	1198863	"Not even root can pretend to send signals from the kernel.
Nor can they impersonate a kill(), which adds source info."
46576	1198976	POSIX.1b doesn't mention process groups.
46608	1199887	"POSIX 3.3.1.3:
""Setting a signal action to SIG_IGN for a signal that is
pending shall cause the pending signal to be discarded,
whether or not it is blocked.""

""Setting a signal action to SIG_DFL for a signal that is
pending and whose default action is to ignore the signal
(for example, SIGCHLD), shall cause the pending signal to
be discarded, whether or not it is blocked"""
46662	1201181	"Note - this code used to test ss_flags incorrectly
old code may have been written using ss_flags==0
to mean ss_flags==SS_ONSTACK (as this was the only
way that worked) - this fix preserves that older
mechanism"
46702	1201919	"Some platforms have their own version with special arguments others
support only sys_rt_sigprocmask."
46752	1202940	__ARCH_WANT_SYS_SIGPROCMASK
46764	1203238	XXX: Don't preclude handling different sized sigset_t's.
46782	1203615	__ARCH_WANT_SYS_RT_SIGACTION
46788	1203730	For backwards compatibility. Functionality superseded by sigprocmask.
46792	1203783	SMP safe
46811	1204158	__ARCH_WANT_SGETMASK
46816	1204268	For backwards compatibility. Functionality superseded by sigaction.
46831	1204640	__ARCH_WANT_SYS_SIGNAL
46850	1204994	XXX: Don't preclude handling different sized sigset_t's.
46869	1205529	__ARCH_WANT_SYS_RT_SIGSUSPEND
46887	1205871	"linux/kernel/softirq.c



Rewritten. Old one was good in 2.2, but in 2.3 it was immoral. --ANK (990903)"
46920	1206910	"- No shared variables, all the data are CPU local.
- If a softirq needs serialization, let it serialize itself
by its own spinlocks.
- Even if softirq is serialized, only local cpu is marked for
execution. Hence, we get something sort of weak cpu binding.
Though it is still not clear, will it result in better locality
or will not.

Examples:
- NET RX softirq. It is multithreaded and does not require
any global serialization.
- NET TX softirq. It kicks software netdevice queues, hence
it is logically serialized per device, but this serialization
is invisible to common code.
- Tasklets: serialized wrt itself."
46936	1207380	"we cannot loop indefinitely here to avoid userspace starvation,
but we also don't want to introduce a worst case 1/HZ latency
to the pending events, so lets the scheduler to balance
the softirq load for us."
46939	1207482	Interrupts are disabled: no need to stop preemption
46949	1207698	"This one is for softirq.c-internal use,
where hardirqs are disabled legitimately:"
46961	1207936	Were softirqs turned off above:
46966	1208070	!CONFIG_TRACE_IRQFLAGS
46972	1208213	CONFIG_TRACE_IRQFLAGS
46988	1208528	"softirqs should never be enabled by __local_bh_enable(),
it always nests inside local_bh_enable() sections:"
46999	1208810	"Special-case - softirqs can safely be enabled in
cond_resched_softirq(), or by __do_softirq(),
without processing still-pending softirqs:"
47026	1209336	Are softirqs going to be turned on now:
47032	1209527	"Keep preemption disabled until we are done with
softirq processing:"
47057	1209997	Are softirqs going to be turned on now:
47063	1210148	"Keep preemption disabled until we are done with
softirq processing:"
47085	1210747	"We restart softirq processing MAX_SOFTIRQ_RESTART times,
and we fall back to softirqd after that.

This number has been established via experimentation.
The two things to balance is latency against fairness -
we want to handle softirqs as soon as possible, but they
should not be able to lock up the box."
47103	1211159	Reset the pending bitmask before enabling irqs
47158	1211876	Enter an interrupt context.
47176	1212219	Exit an interrupt context. Process softirqs if needed and possible:
47186	1212480	Make sure that timer wheel updates are propagated
47195	1212677	This function must run with irqs disabled!
47208	1213043	"If we're in an interrupt or softirq, we're done
(this also catches softirq-disabled code). We will
actually run the softirq once we return from
the irq or softirq.

Otherwise we wake up ksoftirqd to make sure we
schedule the softirq soon."
47228	1213402	Tasklets
47235	1213546	"Some compilers disobey section attribute on statics when not
initialized -- RR"
47383	1216838	"Preempt disable stops cpu going offline.
If already offline, we'll be on wrong CPU:
don't process"
47399	1217168	Wait for kthread_stop
47418	1217700	"tasklet_kill_immediate is called to remove a tasklet which can already be
scheduled for execution on @cpu.

Unlike tasklet_kill, this function removes the tasklet
_immediately_, even if the tasklet is in TASKLET_STATE_SCHED state.

When this function is called, @cpu must be in the CPU_DEAD state."
47429	1217977	CPU is dead, so no lock needed.
47443	1218224	CPU is dead, so no lock needed.
47446	1218290	Find end, append list for that CPU.
47459	1218719	CONFIG_HOTPLUG_CPU
47488	1219454	Unbind so it can run. Fall thru.
47502	1219854	CONFIG_HOTPLUG_CPU
47525	1220289	Call a function on all processors
47555	1221087	"Author: Zwane Mwaikambo <zwane@fsmlabs.com>



This file contains the spinlock/rwlock implementations for the
SMP and the DEBUG_SPINLOCK cases. (UP-nondebug inlines them)

Note that some architectures have special knowledge about the
stack frames of these functions in their profile_pc. If you
change anything significant here that could change the stack
frame contact the architecture maintainers."
47607	1222164	"If lockdep is enabled then we use the non-preemption spin-ops
even on CONFIG_PREEMPT, because lockdep assumes that interrupts are
not re-enabled during lock-acquire (which the preempt-spin-ops do):"
47630	1222825	"On lockdep we dont want the hand-coded irq-enable of
_raw_spin_lock_flags() code, because lockdep assumes
that interrupts are not re-enabled during lock-acquire:"
47736	1225434	CONFIG_PREEMPT:
47744	1225719	"This could be a long-held lock. We both prepare to spin for a long
time (making _this_ CPU preemptable if possible), and we also signal
towards that other CPU that it should break the lock ASAP.

(We do this in a function because inlining it would be excessive.)"
47803	1227182	"
Careful: we must exclude softirqs too, hence the
irq-disabling. We use the generic preemption-aware
function:"
47819	1227755	"Build preemption-friendly versions of the following
lock-spinning functions:

_[spin|read|write]_lock()
_[spin|read|write]_lock_irq()
_[spin|read|write]_lock_irqsave()
_[spin|read|write]_lock_bh()"
47824	1227877	CONFIG_PREEMPT
47847	1228536	"On lockdep we dont want the hand-coded irq-enable of
_raw_spin_lock_flags() code, because lockdep assumes
that interrupts are not re-enabled during lock-acquire:"
47982	1231757	Linker adds these: start and end of __lockfunc functions
47994	1232018	linux/kernel/sys.c
48063	1233662	"this is where the system-wide overflow UID and GID are defined, for
architectures that now have 32-bit UID/GID but didn't in the past"
48076	1233966	"the same as above, but for filesystems which can only store a 16-bit
UID and GID. as such, this is needed on all architectures"
48086	1234207	this indicates whether you can reboot with ctrl-alt-del: the default is yes
48094	1234339	If set, this is used for preparing the system to power off.
48133	1235143	normalize: avoid signed division (rounding problems)
48165	1235881	No processes for this user
48172	1236074	For find_user()
48186	1236372	"Ugh. To avoid negative return values, ""getpriority()"" will
not return the normal nice-value, but a negated value that
has been offset by 20 (ie it returns 40..1 instead of -20..19)
to stay compatible."
48227	1237329	No processes for this user
48237	1237569	for find_user()
48253	1237911	"emergency_restart - reboot the system

Without shutting down any hardware or taking any locks
reboot the system. This is called when we know we are in
trouble so this is our best effort to reboot. This is
safe to call in interrupt context."
48275	1238440	"kernel_restart - reboot the system
@cmd: pointer to buffer containing command to execute for restart
or %NULL

Shutdown everything and perform a clean reboot.
This is not safe to call in interrupt context."
48292	1238861	"kernel_kexec - reboot the system

Move into place and start executing a preloaded standalone
executable. If nothing was preloaded return an error."
48318	1239436	"kernel_halt - halt the system

Shutdown everything and perform a clean system halt."
48333	1239728	"kernel_power_off - power_off the system

Shutdown everything and perform a clean system power_off."
48352	1240333	"Reboot system call: for obvious reasons only root may call it,
and even root needs to set up some magic numbers in the registers
so that some mistake won't make this reboot the whole machine.
You can also set the meaning of the ctrl-alt-del-key here.

reboot doesn't sync: do that yourself before calling this."
48357	1240505	We only trust the superuser with rebooting the system.
48361	1240601	"For safety, we require ""magic"" arguments."
48371	1240957	"Instead of trying to make the power_off code look like
halt when pm_power_off is not set do it the easy way."
48442	1242266	"This function gets called by ctrl-alt-del - ie the keyboard interrupt.
As it's called within an interrupt, it may NOT sync: the only choice
is whether to reboot at once, or just ignore the ctrl-alt-del."
48470	1243197	"Unprivileged users may change the real gid to the effective gid
or vice versa. (BSD-style)

If you set the real gid at all, or set the effective gid to a value not
equal to the real gid, then the saved gid is set to the new effective gid.

This makes it possible for a setgid program to completely drop its
privileges, which is often a useful assertion to make when you are doing
a security audit over a program.

The general idea is that a program which uses just setregid() will be
100% compatible with BSD. A program which uses just setgid() will be
100% compatible with POSIX with saved IDs.

SMP: There are not races, the GIDs are checked only by filesystem
operations (as far as semantic preservation is concerned)."
48519	1244295	"setgid() is implemented like SysV w/ SAVED_IDS

SMP: Same implicit races as above."
48589	1246136	"Unprivileged users may change the real uid to the effective uid
or vice versa. (BSD-style)

If you set the real uid at all, or set the effective uid to a value not
equal to the real uid, then the saved uid is set to the new effective uid.

This makes it possible for a setuid program to completely drop its
privileges, which is often a useful assertion to make when you are doing
a security audit over a program.

The general idea is that a program which uses just setreuid() will be
100% compatible with BSD. A program which uses just setuid() will be
100% compatible with POSIX with saved IDs."
48651	1247881	"setuid() is implemented like SysV with SAVED_IDS

Note that SAVED_ID's is deficient in that a setuid root program
like sendmail, for example, cannot set its uid to be a normal
user and then switch back, because if you're root, setuid() sets
the saved uid too. If you don't like this, blame the bright people
in the POSIX committee and/or USG. Note that the BSD-style setreuid()
will allow a root program to temporarily drop privileges and be able to
regain them by swapping the real and effective uid."
48690	1248839	"This function implements a generic ability to update ruid, euid,
and suid. This allows you to implement the 4.4 compatible seteuid()."
48747	1250364	Same as above, but for rgid, egid, sgid.
48802	1251873	"""setfsuid()"" sets the fsuid - the uid used for filesystem checks. This
is used for ""access()"" and for the NFS daemon (letting nfsd stay at
whatever uid it wants to). It normally shadows ""euid"", except when
explicitly set by setfsuid() or for access.."
48831	1252504	Samma p svenska..
48861	1253331	"In the SMP world we might just be unlucky and have one of
the times increment as we use it. Since the value is an
atomically safe type this is just fine. Conceptually its
as if the syscall took an instant longer to occur."
48903	1254615	"This needs some heavy checking ...
I just haven't the stomach for it. I also don't fully
understand sessions/pgrp etc. Let somebody who does explain it.

OK, I think I have the protection semantics right.... this is really
only important on a multi-user system anyway, to make sure one user
can't send a signal to a process owned by another. -TYT, 12/12/91

Auch. Had to add the 'did_exec' flag to conform completely to POSIX.
LBT 04.03.94"
48920	1255039	"From this point forward we keep holding onto the tasklist lock
so that our parent does not change from under us. -DaveM"
48974	1256038	All paths lead to here, thus we are safe. -DaveM
49007	1256654	SMP - assuming writes are word atomic this is fine
49045	1257349	Fail if I am already a session leader
49056	1257696	"Fail if a process group id already exists that equals the
proposed session id.

Don't check if session id == 1 because kernel threads use this
session id and so the check will always fail and make it so
init cannot successfully call setsid."
49076	1258125	Supplementary group IDs
49078	1258195	init to 2 - one for init_task, one to ensure it is never freed
49088	1258503	Make sure we always allocate at least one indirect block pointer
49132	1259512	export the group_info to a user-space array
49152	1260015	fill a group_info from a user-space array - it must be allocated already
49172	1260469	a simple Shell sort
49179	1260672	nothing
49201	1261126	a simple bsearch
49224	1261544	validate and set current->group_info
49256	1262133	"SMP: Nobody else can change our grouplist. Thus we are
safe."
49261	1262230	no need to grab task_lock here; it cannot change
49280	1262557	"SMP: Our groups are copy-on-write. We can set them safely
without another task interfering."
49309	1263138	Check whether we're fsgid/egid or in the supplemental group..
49389	1264598	"Only setdomainname; getdomainname can be implemented by calling
uname()"
49428	1265473	Back compatibility for getrlimit. Needed for some apps.
49477	1266822	"The caller is asking for an immediate RLIMIT_CPU
expiry. But we use the zero value to mean ""it was
never set"". So let's cheat and make it one second
instead"
49493	1267247	"RLIMIT_CPU handling. Note that the kernel fails to return an error
code if it rejected the user's attempt to set RLIMIT_CPU. This is a
very long-standing error, and fixing it now risks breakage of
applications, so we live with it"
49544	1269557	"It would make sense to put struct rusage in the task_struct,
except that would make the task_struct be *really big*. After
task_struct gets moved into malloc'ed memory, it would
make sense to do this. It will make moving the rest of the information
a lot simpler! (Which we're not doing right now because we're not
measuring them yet).

When sampling multiple threads for RUSAGE_SELF, under SMP we might have
races with threads incrementing their own counters. But since word
reads are atomic, we either get new values or old values and we don't
care which for the sums. We always take the siglock to protect reading
the c* fields from p->signal from races with exit.c updating those
fields when reaping, so a sample either gets all the additions of a
given child after it's reaped, or none so this sample is before reaping.

Locking:
We need to take the siglock for CHILDEREN, SELF and BOTH
for the cases current multithreaded, non-current single threaded
non-current multithreaded. Thread traversal is now safe with
the siglock held.
Strictly speaking, we donot need to take the siglock if we are current and
single threaded, as no one else can take our signal_struct away, no one
else can reap the children to update signal->c* counters, and no one else
can race with the signal-> fields. If we do not take any lock, the
signal-> fields could be read out of order while another thread was just
exiting. So we should place a read memory barrier when we avoid the lock.
On the writer side, write memory barrier is implied in __exit_signal
as __exit_signal releases the siglock spinlock after updating the signal->
fields. But we don't do this yet to keep things simple."
49766	1274702	"orderly_poweroff - Trigger an orderly system poweroff
@force: force poweroff if command execution fails

This may be called from any context to trigger a system shutdown.
If the orderly shutdown fails, it will force an immediate shutdown."
49802	1275585	"I guess this should try to kick off some daemon to
sync and poweroff asap. Or not even bother syncing
if we're doing an emergency shutdown?"
49844	1276555	KERN_OSREV not used
49847	1276619	"KERN_SECUREMASK not used
KERN_PROF not used"
49853	1276832	def CONFIG_SECURITY_CAPABILITIES
49864	1277042	"KERN_NAMETRANS not used
KERN_PPC_HTABRECLAIM not used
KERN_PPC_ZEROPAGED not used"
49873	1277318	"KERN_RTSIGNR not used
KERN_RTSIGMAX not used"
49878	1277467	KERN_MSGPOOL not used
49934	1279461	VM_PAGEBUF unused
49945	1279926	VM_SWAP_TOKEN_TIMEOUT unused
49962	1280503	NET_CORE_DESTROY_DELAY unused
49964	1280586	NET_CORE_FASTROUTE unused
49973	1280750	"NET_CORE_HOT_LIST_LENGTH unused
NET_CORE_DIVERT_VERSION unused
NET_CORE_NO_CONG_THRESH unused
NET_CORE_NO_CONG unused
NET_CORE_LO_CONG unused
NET_CORE_MOD_CONG unused"
49985	1281280	"NET_UNIX_DESTROY_DELAY unused
NET_UNIX_DELETE_DELAY unused"
50119	1287554	NET_IPV4_FIB_HASH unused
50127	1287911	NET_IPV4_AUTOCONFIG unused
50133	1288207	NET_IPV4_TCP_MAX_KA_PROBES unused
50139	1288502	NET_IPV4_IP_MASQ_DEBUG unused
50143	1288658	NET_TCP_SYN_TAILDROP unused
50152	1288948	"NET_IPV4_ICMP_SOURCEQUENCH_RATE unused
NET_IPV4_ICMP_DESTUNREACH_RATE unused
NET_IPV4_ICMP_TIMEEXCEED_RATE unused
NET_IPV4_ICMP_PARAMPROB_RATE unused
NET_IPV4_ICMP_ECHOREPLY_RATE unused"
50156	1289351	NET_IPV4_ALWAYS_DEFRAG unused
50186	1290762	NET_TCP_DEFAULT_WIN_SCALE unused
50189	1290901	NET_TCP_BIC_BETA unused
50207	1291893	NET_IPQ_QMAX
50213	1292072	NET_IPX_FORWARDING unused
50352	1297936	IPQ_QMAX
50511	1304483	"NET_ETHER not used
NET_802 not used"
50524	1305115	NET_ECONET not used
50590	1307048	"FS_MAXINODE unused
FS_NRDQUOT unused
FS_MAXDQUOT unused"
50595	1307215	"FS_NRSUPER unused
FS_MAXUPSER unused"
50632	1308303	"DEV_MAC_HID_KEYBOARD_SENDS_LINUX_KEYCODES unused
DEV_MAC_HID_KEYBOARD_LOCK_KEYCODES unused"
50636	1308600	DEV_MAC_HID_ADB_MOUSE_SENDS_KEYCODES unused
50690	1310154	DEV_HWMON unused
51005	1317728	"CTL_S390DBF_STOPPABLE
CTL_S390DBF_ACTIVE"
51025	1318261	"CTL_PM_SUSPEND
CTL_PM_CMODE
CTL_PM_P0
CTL_PM_CM"
51039	1318680	CTL_PROC not used
51045	1318883	CTL_CPU not used
51148	1320898	"Don't complain about the classic default
sysctl strategy routine. Maybe later we
can get the tables fixed and complain about
this."
51311	1325304	def CONFIG_SECURITY_CAPABILITIES
51379	1327755	"sysctl.c: General linux system control interface

Begun 24 March 1995, Stephen Tweedie
Added /proc support, Dec 1995
Added bdflush entry and intvec min/max checking, 2/23/96, Tom Dyas.
Added hooks for /proc/sys/net (minor, minor patch), 96/4/1, Mike Shaver.
Added kernel/java-{interpreter,appletviewer}, 96/5/10, Mike Shaver.
Dynamic registration fixes, Stephen Tweedie.
Added kswapd-interval, ctrl-alt-del, printk stuff, 1/8/97, Chris Horn.
Made sysctl support optional via CONFIG_SYSCTL, 1/10/97, Chris
Horn.
Added proc_doulongvec_ms_jiffies_minmax, 09/08/99, Carlos H. Bauer.
Added proc_doulongvec_minmax, 09/08/99, Carlos H. Bauer.
Changed linked lists to use list.h instead of lists.h, 02/24/00, Bill
Wendling.
The list_for_each() macro wasn't appropriate for the sysctl loop.
Removed it and replaced it with older style, 03/23/00, Bill Wendling"
51422	1328749	External variables not in a header file.
51445	1329431	Constants used for minimum and maximum
51458	1329688	this is needed for the proc_dointvec_minmax for [fs_]overflow UID and GID
51539	1331574	The default sysctl tables:
51583	1332309	"NOTE: do not add new entries to this table unless you have read
Documentation/sysctl/ctl_unnumbered.txt"
51591	1332421	"100 usecs
1 second
0 usecs
1 second"
51753	1336547	def CONFIG_SECURITY_CAPABILITIES
52141	1345222	"NOTE: do not add new entries to this table unless you have read
Documentation/sysctl/ctl_unnumbered.txt"
52227	1347443	read-only
52447	1353067	"NOTE: do not add new entries to this table unless you have read
Documentation/sysctl/ctl_unnumbered.txt"
52591	1356163	"NOTE: do not add new entries to this table unless you have read
Documentation/sysctl/ctl_unnumbered.txt"
52615	1356618	called under sysctl_lock
52624	1356771	called under sysctl_lock
52632	1356972	called under sysctl_lock, will reacquire if has to wait
52638	1357169	"if p->used is 0, nobody will ever touch that entry again;
we'll eliminate all paths to it before dropping sysctl_lock"
52650	1357480	"do not remove from the list until nobody holds it; walking the
list in do_sysctl() relies on that."
52736	1359281	CONFIG_SYSCTL_SYSCALL
52741	1359419	"sysctl_perm does NOT grant the superuser all rights automatically, because
some sysctl variables are readonly even to root."
52797	1360562	Perform the actual read/write of a sysctl table entry.
52822	1361121	"If there is no strategy routine, or if the strategy returns
zero, proceed with automatic r/w"
52831	1361314	CONFIG_SYSCTL_SYSCALL
